{"apiVersion":"tplaiter.dev/state-migration-plan/v1","entries":[{"classification":"project-marker","exists":true,"kind":"file","mode":420,"owner":"project","path":".tplaiter/project.yaml","retention":"permanent","scope":"project","sha256":"sha256:cdd5b34ba5e1f973ee3836b68d6ccafe0c6d2ece7808fece43e527e142fb5ff7","wireVersion":"v1alpha1-or-v2"},{"classification":"root-lock","exists":true,"kind":"file","mode":420,"owner":"new-update-link","path":".tplaiter/root-template.lock.json","retention":"permanent","scope":"project","sha256":"sha256:a44d45a89af10ebcceb9479b7252b75bc660fb5b4b652ce75be4d497e848b3e2","wireVersion":"v2"}],"from":"tplater.dev/v1alpha1","mutations":[{"action":"migrate","afterSHA256":"sha256:1250127335c82d78571beddad78e4492cc6171038204953fd4a97cc1b9a27f0b","beforeSHA256":"sha256:cdd5b34ba5e1f973ee3836b68d6ccafe0c6d2ece7808fece43e527e142fb5ff7","path":".tplaiter/project.yaml"},{"action":"synthesize","afterSHA256":"sha256:702a60af90df9cefebe4140aba51e05a9e2b0e8478e960611258d4c4cea0fb06","path":".tplaiter/template.lock.json"}],"planSHA256":"sha256:ba62d97a4617268eb89bde3c8e76f5c7dae05106d601f305ff7e9cd606021512","projectID":"123e4567-e89b-12d3-a456-426614174000","to":"tplaiter.dev/project/v2"}
